question_id,db_id,question,evidence,SQL,table_names,cte_aliases
411,card_games,"to which artist does the card with the text ""das perfekte gegenmittel zu einer dichten formation"" belong?",,SELECT DISTINCT T1.artist FROM cards AS T1 INNER JOIN foreign_data AS T2 ON T1.uuid = T2.uuid WHERE T2.flavorText LIKE '%DAS perfekte Gegenmittel zu einer dichten Formation%',"['cards', 'foreign_data']",[]
412,card_games,"what is the foreign name of the card in french of type creature, normal layout and black border color, by artist matthew d. wilson?",in french refers to language = 'french'; black border color refers to bordercolor = 'black',SELECT name FROM foreign_data WHERE uuid IN ( SELECT uuid FROM cards WHERE types = 'Creature' AND layout = 'normal' AND borderColor = 'black' AND artist = 'Matthew D. Wilson' ) AND language = 'French',"['cards', 'foreign_data']",[]
413,card_games,how many cards with print rarity have ruling text printed on 01/02/2007?,with print rarity refers to rarity = 'rare'; on 01/02/2007 refers to date = '2007-02-01',SELECT COUNT(DISTINCT T1.id) FROM cards AS T1 INNER JOIN rulings AS T2 ON T1.uuid = T2.uuid WHERE T1.rarity = 'rare' AND T2.date = '2007-02-01',"['cards', 'rulings']",[]
414,card_games,what language is the set of 180 cards that belongs to the ravnica block translated into?,set of 180 cards refers to basesetsize = 180,SELECT T2.language FROM sets AS T1 INNER JOIN set_translations AS T2 ON T1.code = T2.setCode WHERE T1.block = 'Ravnica' AND T1.baseSetSize = 180,"['sets', 'set_translations']",[]
415,card_games,what percentage of cards with format commander and legal status do not have a content warning?,"do not have a content warning refers to hascontentwarning = 0; percentage refers to divide(count(hascontentwarning = 0),count(id))*100 where format = 'commander' and status = 'legal';",SELECT CAST(SUM(CASE WHEN T1.hasContentWarning = 0 THEN 1 ELSE 0 END) AS REAL) * 100 / COUNT(T1.id) FROM cards AS T1 INNER JOIN legalities AS T2 ON T1.uuid = T2.uuid WHERE T2.format = 'commander' AND T2.status = 'Legal',"['cards', 'legalities']",[]
416,card_games,what percentage of cards without power are in french?,"in french refers to language = 'french'; cards without power refers to power is null or power = '*'; percentage = divide(count(language = 'french' and power is null or power = '*'), count( power is null or power = '*'))*100",SELECT CAST(SUM(CASE WHEN T2.language = 'French' THEN 1 ELSE 0 END) AS REAL) * 100 / COUNT(T1.id) FROM cards AS T1 INNER JOIN foreign_data AS T2 ON T1.uuid = T2.uuid WHERE T1.power IS NULL OR T1.power = '*',"['cards', 'foreign_data']",[]
417,card_games,what percentage of japanese translated sets are expansion sets?,"japanese translated refers to language = 'japanese'; expansion sets refers to type = 'expansion'; percentage = divide(count(language = 'japanese'),count(language))*100",SELECT CAST(SUM(CASE WHEN T2.language = 'Japanese' THEN 1 ELSE 0 END) AS REAL) * 100 / COUNT(T1.id) FROM sets AS T1 INNER JOIN set_translations AS T2 ON T1.code = T2.setCode WHERE T1.type = 'expansion',"['sets', 'set_translations']",[]
418,card_games,what kind of printing is on the card that daren bader created?,kind of printing refers to availability; daren bader created refers to artist = 'daren bader',SELECT DISTINCT availability FROM cards WHERE artist = 'Daren Bader',['cards'],[]
419,card_games,how many color cards with no borders have been ranked higher than 12000 on edhrec?,color cards with no borders refers to bordercolor = 'borderless'; ranked higher than 12000 on edhrec refers to edhrecrank > 12000,SELECT COUNT(id) FROM cards WHERE edhrecRank > 12000 AND borderColor = 'borderless',['cards'],[]
420,card_games,"how many cards are oversized, reprinted, and printed for promotions?",are oversized refers to isoversized = 1; reprinted refers to isreprint = 1; printed for promotions refers to ispromo = 1,SELECT COUNT(id) FROM cards WHERE isOversized = 1 AND isReprint = 1 AND isPromo = 1,['cards'],[]
421,card_games,please list top three unknown power cards that have promotional types for arena league in alphabetical order.,unknown power cards refers to power is null or power = '*'; promotional types for arena league refers to promotypes = 'arenaleague',SELECT name FROM cards WHERE (power IS NULL OR power LIKE '%*%') AND promoTypes = 'arenaleague' ORDER BY name LIMIT 3,['cards'],[]
422,card_games,what is the language of the card with the multiverse number 149934?,multiverse number 149934 refers to multiverseid = 149934;,SELECT language FROM foreign_data WHERE multiverseid = 149934,['foreign_data'],[]
423,card_games,please provide the ids of top three powerful pairs of kingdom foil and kingdom cards sorted by kingdom foil id in alphabetical order.,poweful refers to cardkingdomfoilid is not null and cardkingdomid is not null,"SELECT cardKingdomFoilId, cardKingdomId FROM cards WHERE cardKingdomFoilId IS NOT NULL AND cardKingdomId IS NOT NULL ORDER BY cardKingdomFoilId LIMIT 3",['cards'],[]
424,card_games,what proportion of cards do not have a text box with a normal layout?,"do not have a text box refers to istextless = 1; proportion refers to divide(count(textless = 1 and layout = 'normal'),count(textless))*100",SELECT CAST(SUM(CASE WHEN isTextless = 1 AND layout = 'normal' THEN 1 ELSE 0 END) AS REAL) * 100 / COUNT(*) FROM cards,['cards'],[]
425,card_games,what are the card numbers that don't have multiple faces on a single card and have the subtypes angel and wizard?,don't have multiple faces on a single card side is null,"SELECT id FROM cards WHERE subtypes = 'Angel,Wizard' AND side IS NULL",['cards'],[]
426,card_games,"please provide top three sets that don't appear in magic: the gathering online, along with their names in in alphabetical order.",don't appear in magic: the gathering online refers to mtgocode is null or mtgocode = '',SELECT name FROM sets WHERE mtgoCode IS NULL ORDER BY name LIMIT 3,['sets'],[]
427,card_games,what languages are available in the set known as archenemy on the magic card market and having the code arc?,known as archenemy refers to mcmname = 'archenemy'; having the code arc refers to setcode = 'arc',SELECT T2.language FROM sets AS T1 INNER JOIN set_translations AS T2 ON T1.code = T2.setCode WHERE T1.mcmName = 'Archenemy' AND T2.setCode = 'ARC',"['sets', 'set_translations']",[]
428,card_games,what is the name of set number 5 and its translation?,set number 5 refers to id = 5,"SELECT T1.name, T2.translation FROM sets AS T1 INNER JOIN set_translations AS T2 ON T1.code = T2.setCode WHERE T2.id = 5 GROUP BY T1.name, T2.translation","['sets', 'set_translations']",[]
429,card_games,what is the language and expansion type of set number 206?,set number 206 refers to id = 206,"SELECT T2.language, T1.type FROM sets AS T1 INNER JOIN set_translations AS T2 ON T1.code = T2.setCode WHERE T2.id = 206","['sets', 'set_translations']",[]
430,card_games,please list top two sets of cards with their ids that have italian-language cards and are located in the shadowmoor block in alphabetical order.,,"SELECT T1.name, T1.id FROM sets AS T1 INNER JOIN set_translations AS T2 ON T1.code = T2.setCode WHERE T1.block = 'Shadowmoor' AND T2.language = 'Italian' ORDER BY T1.id LIMIT 2","['sets', 'set_translations']",[]
431,card_games,which set is not available outside of the united states and has foil cards with japanese writing on them? please include the set id in your response.,available outside of the united states refers to isforeignonly = 1; has foil cards refers to isfoilonly = 1; with japanese writing on them refers to language = 'japanese',"SELECT T1.name, T1.id FROM sets AS T1 INNER JOIN set_translations AS T2 ON T1.code = T2.setCode WHERE T2.language = 'Japanese' AND T1.isFoilOnly = 1 AND T1.isForeignOnly = 0","['sets', 'set_translations']",[]
432,card_games,which russian set of cards contains the most cards overall?,russian refers to language = 'russian'; contains the most cards overall refers to max(basesetsize),SELECT T1.id FROM sets AS T1 INNER JOIN set_translations AS T2 ON T1.code = T2.setCode WHERE T2.language = 'Russian' GROUP BY T1.baseSetSize ORDER BY T1.baseSetSize DESC LIMIT 1,"['sets', 'set_translations']",[]
433,card_games,what is the percentage of the set of cards that have chinese simplified as the language and are only available for online games?,"are only available for online games refers to isonlineonly = 1; percentage = divide(count(isonlineonly = 1),count(isonlineonly))*100",SELECT CAST(SUM(CASE WHEN T2.language = 'Chinese Simplified' AND T1.isOnlineOnly = 1 THEN 1 ELSE 0 END) AS REAL) * 100 / COUNT(*) FROM sets AS T1 INNER JOIN set_translations AS T2 ON T1.code = T2.setCode,"['sets', 'set_translations']",[]
434,card_games,how many sets are available just in japanese and not in magic: the gathering online?,japanese refers to language = 'japanese'; not in magic: the gathering online refers to mtgocode is null or mtgocode = '',SELECT COUNT(T1.id) FROM sets AS T1 INNER JOIN set_translations AS T2 ON T2.setCode = T1.code WHERE T2.language = 'Japanese'  AND (T1.mtgoCode IS NULL OR T1.mtgoCode = ''),"['sets', 'set_translations']",[]
435,card_games,how many card border with black color ? list out the card id.,border with black color refers to bordercolor = 'black',SELECT id FROM cards WHERE borderColor = 'black' GROUP BY id,['cards'],[]
436,card_games,how many cards have frame effect as extendedart? list out the id of those cards.,"
frame effect as extendedart refers to frameeffects = 'extendedart'
",SELECT id FROM cards WHERE frameEffects = 'extendedart' GROUP BY id,['cards'],[]
437,card_games,"among black card borders, which card has full artwork?",white card borders refers to bordercolor = 'white'; has full artwork refers to isfullart = 1,SELECT id FROM cards WHERE borderColor = 'black' AND isFullArt = 1,['cards'],[]
438,card_games,"point out the language of set id ""174""?",,SELECT language FROM set_translations WHERE id = 174,['set_translations'],[]
439,card_games,"list out the set name of the set code ""all"".",,SELECT name FROM sets WHERE code = 'ALL',['sets'],[]
440,card_games,"which foreign language used by ""a pedra fellwar""?","""a pedra fellwar"" refers to name = 'a pedra fellwar'",SELECT DISTINCT language FROM foreign_data WHERE name = 'A Pedra Fellwar',['foreign_data'],[]
441,card_games,state the set code of the set with release date of 07/13/2007?,,SELECT T2.setCode FROM sets AS T1 INNER JOIN set_translations AS T2 ON T2.setCode = T1.code WHERE T1.releaseDate = '2007-07-13',"['sets', 'set_translations']",[]
442,card_games,"mention the base set size and set code of the set that was in block named ""masques"" and ""mirage"".",,"SELECT DISTINCT T1.baseSetSize, T2.setCode FROM sets AS T1 INNER JOIN set_translations AS T2 ON T2.setCode = T1.code WHERE T1.block IN ('Masques', 'Mirage')","['sets', 'set_translations']",[]
443,card_games,give the code of sets have expansion type of 'expansion'?,code of sets refers to setcode,SELECT T2.setCode FROM sets AS T1 INNER JOIN set_translations AS T2 ON T2.setCode = T1.code WHERE T1.type = 'expansion' GROUP BY T2.setCode,"['sets', 'set_translations']",[]
444,card_games,name the foreign name of the card that has boros watermark? list out the type of this card.,,"SELECT DISTINCT T1.name, T1.type FROM cards AS T1 INNER JOIN foreign_data AS T2 ON T2.uuid = T1.uuid WHERE T1.watermark = 'boros'","['cards', 'foreign_data']",[]
445,card_games,what is the language and flavor text of the card that has colorpie watermark? list out the type of this card.,,"SELECT DISTINCT T2.language, T2.flavorText FROM cards AS T1 INNER JOIN foreign_data AS T2 ON T2.uuid = T1.uuid WHERE T1.watermark = 'colorpie'","['cards', 'foreign_data']",[]
446,card_games,what is percentage of the cards with a converted mana cost of 10 in set of abyssal horror?,"set of abyssal horror refers to name = 'abyssal horror'; percentage refers to divide(count(convertedmanacost = 16),count(convertedmanacost))*100","SELECT CAST(SUM(CASE WHEN T1.convertedManaCost = 10 THEN 1 ELSE 0 END) AS REAL) * 100 / COUNT(T1.id), T1.name FROM cards AS T1 INNER JOIN sets AS T2 ON T2.code = T1.setCode WHERE T1.name = 'Abyssal Horror'","['cards', 'sets']",[]
447,card_games,give the code of sets have expansion commander type?,code of sets refers to setcode,SELECT T2.setCode FROM sets AS T1 INNER JOIN set_translations AS T2 ON T2.setCode = T1.code WHERE T1.type = 'commander',"['sets', 'set_translations']",[]
448,card_games,name the foreign name of the card that has abzan watermark? list out the type of this card.,,"SELECT DISTINCT T1.name, T1.type FROM cards AS T1 INNER JOIN foreign_data AS T2 ON T2.uuid = T1.uuid WHERE T1.watermark = 'abzan'","['cards', 'foreign_data']",[]
449,card_games,what is the language of the card that has azorius watermark? list out the type of this card.,,"SELECT DISTINCT T2.language, T1.type FROM cards AS T1 INNER JOIN foreign_data AS T2 ON T2.uuid = T1.uuid WHERE T1.watermark = 'azorius'","['cards', 'foreign_data']",[]
450,card_games,"of all the cards that are designed by aaron miller, how many of them are incredibly powerful?",designed by aaron miller refers to artist = 'aaron miller'; are icredibily powerful refers to cardkingdomfoilid is not null and cardkingdomid is not null,SELECT SUM(CASE WHEN artist = 'Aaron Miller' AND cardKingdomFoilId IS NOT NULL AND cardKingdomId IS NOT NULL THEN 1 ELSE 0 END) FROM cards,['cards'],[]
451,card_games,how many cards available in paper have a positive starting maximum hand size?,available in paper refers to availability like '%paper%'; have a positive starting maximum hand size refers to hand = '3',SELECT SUM(CASE WHEN availability = 'paper' AND hAND = '3' THEN 1 ELSE 0 END) FROM cards,['cards'],[]
452,card_games,please list the names of the cards that have a text box.,have a text box refers to istextless = 0,SELECT DISTINCT name FROM cards WHERE isTextless = 0,['cards'],[]
453,card_games,"what's the unconverted mana cost of the card ""ancestor's chosen""?","card ""ancestor's chosen"" refers to name = 'ancestor`s chosen'",SELECT DISTINCT manaCost FROM cards WHERE name = 'Ancestor''s Chosen',['cards'],[]
454,card_games,"among the cards with a white border color, how many of them have unknown power?",unknown power refers to power = '*' or power is null,SELECT SUM(CASE WHEN power LIKE '%*%' OR power IS NULL THEN 1 ELSE 0 END) FROM cards WHERE borderColor = 'white',['cards'],[]
455,card_games,which of the cards that are a promotional painting have multiple faces on the same card? please list their names.,are a promotional painting refers to ispromo = 1; have multiple faces on the same card refers to side is not null,SELECT DISTINCT name FROM cards WHERE isPromo = 1 AND side IS NOT NULL,['cards'],[]
456,card_games,"what's the list of all types for the card ""molimo, maro-sorcerer""?","card ""molimo, maro-sorcerer"" refers to name = 'molimo, maro-sorcerer'; list of all types refers to subtypes,supertypes","SELECT DISTINCT subtypes, supertypes FROM cards WHERE name = 'Molimo, Maro-Sorcerer'",['cards'],[]
457,card_games,"please list the websites where i can purchase the cards that have the promotional type of ""bundle"".","promotional type of ""bundle"" refers to promotypes = 'bundle'; websites refers to purchaseurls",SELECT DISTINCT purchaseUrls FROM cards WHERE promoTypes = 'bundle',['cards'],[]
458,card_games,"how many artists have designed a card with a black border color and is available in both ""arena"" and ""mtgo"" printing type?","available in both ""arena"" and ""mtgo"" refers to availability like '%arena,mtgo%'","SELECT COUNT(CASE WHEN availability LIKE '%arena,mtgo%' AND borderColor = 'black' THEN 1 ELSE NULL END) FROM cards",['cards'],[]
459,card_games,"which card costs more converted mana, ""serra angel"" or ""shrine keeper""?","""serra angel"" refers to name = 'serra angel'; ""shrine keeper"" refers to name = 'shrine keeper'; card costs more converted mana when the value of convertedmanacost is greater","SELECT name FROM cards WHERE name IN ('Serra Angel', 'Shrine Keeper') ORDER BY convertedManaCost DESC LIMIT 1",['cards'],[]
460,card_games,"which artist designed the card whose promotional name is ""battra, dark destroyer""?","promotional name is ""battra, dark destroyer"" refers to flavorname = 'battra, dark destroyer'","SELECT artist FROM cards WHERE flavorName = 'Battra, Dark Destroyer'",['cards'],[]
461,card_games,please list the names of the top 3 cards with the highest converted mana cost and have a 2003 card frame style.,name of cards refers to name; 2003 card frame style refers to frameversion = '2003',SELECT name FROM cards WHERE frameVersion = 2003 ORDER BY convertedManaCost DESC LIMIT 3,['cards'],[]
462,card_games,"what's the italian name of the set of cards with ""ancestor's chosen"" is in?","italian is a language which refers to language = 'italian'; with ""ancestor's chosen"" in the card set refers to name = 'ancestor''s chosen'",SELECT translation FROM set_translations WHERE setCode IN ( SELECT setCode FROM cards WHERE name = 'Ancestor''s Chosen' ) AND language = 'Italian',"['cards', 'set_translations']",[]
463,card_games,"how many translations are there for the set of cards with ""angel of mercy"" in it?","set of cards with ""angel of mercy"" in it refers to name = 'angel of mercy'",SELECT COUNT(DISTINCT translation) FROM set_translations WHERE setCode IN ( SELECT setCode FROM cards WHERE name = 'Angel of Mercy' ) AND translation IS NOT NULL,"['cards', 'set_translations']",[]
464,card_games,"please list the names of the cards in the set ""hauptset zehnte edition"".","card set ""hauptset zehnte edition"" refers to translation = 'hauptset zehnte edition'",SELECT DISTINCT T1.name FROM cards AS T1 INNER JOIN set_translations AS T2 ON T2.setCode = T1.setCode WHERE T2.translation = 'Hauptset Zehnte Edition',"['cards', 'set_translations']",[]
465,card_games,"for the set of cards with ""ancestor's chosen"" in it, is there a korean version of it?","set of cards with ""ancestor''s chosen"" in it refers to name = 'ancestor''s chosen'; korean version refers to language = 'korean'","SELECT IIF(SUM(CASE WHEN T2.language = 'Korean' AND T2.translation IS NOT NULL THEN 1 ELSE 0 END) > 0, 'YES', 'NO') FROM cards AS T1 INNER JOIN set_translations AS T2 ON T2.setCode = T1.setCode WHERE T1.name = 'Ancestor''s Chosen'","['cards', 'set_translations']",[]
466,card_games,"among the cards in the set ""hauptset zehnte edition"", how many of them are designed by adam rex?","card set ""hauptset zehnte edition"" refers to translation = 'hauptset zehnte edition'; designed by adam refers to artist = 'adam rex'",SELECT COUNT(T1.id) FROM cards AS T1 INNER JOIN set_translations AS T2 ON T2.setCode = T1.setCode WHERE T2.translation = 'Hauptset Zehnte Edition' AND T1.artist = 'Adam Rex',"['cards', 'set_translations']",[]
467,card_games,"how many cards are there in the base set of ""hauptset zehnte edition""?","""hauptset zehnte edition"" refers to translation = 'hauptset zehnte edition'; number of cards refers to basesetsize",SELECT T1.baseSetSize FROM sets AS T1 INNER JOIN set_translations AS T2 ON T2.setCode = T1.code WHERE T2.translation = 'Hauptset Zehnte Edition',"['sets', 'set_translations']",[]
468,card_games,"what is the simplified chinese translation of the name of the set ""eighth edition""?",eighth edition is the name of card set which refers to name = 'eighth edition'; simplified chinese refers to language = 'chinese simplified'; translation of the name refers to translation,SELECT T2.translation FROM sets AS T1 INNER JOIN set_translations AS T2 ON T2.setCode = T1.code WHERE T1.name = 'Eighth Edition' AND T2.language = 'Chinese Simplified',"['sets', 'set_translations']",[]
469,card_games,"did the set of cards with ""angel of mercy"" appear on magic: the gathering online?","card set ""angel of mercy"" refers to name = 'angel of mercy'; appear on magic: the gathering online refers to mtgocode is not null and vice versa","SELECT IIF(T2.mtgoCode IS NOT NULL, 'YES', 'NO') FROM cards AS T1 INNER JOIN sets AS T2 ON T2.code = T1.setCode WHERE T1.name = 'Angel of Mercy'","['cards', 'sets']",[]
470,card_games,"when was the set of cards with ""ancestor's chosen"" released?","card set ""ancestor's chosen"" refers to name = 'ancestor''s chosen'; when released refers to releasedate",SELECT DISTINCT T2.releaseDate FROM cards AS T1 INNER JOIN sets AS T2 ON T2.code = T1.setCode WHERE T1.name = 'Ancestor''s Chosen',"['cards', 'sets']",[]
471,card_games,"what is the expansion type of the set ""hauptset zehnte edition""?","card set ""hauptset zehnte edition"" refers to translation = ' hauptset zehnte edition'; expansion type refers to type",SELECT T1.type FROM sets AS T1 INNER JOIN set_translations AS T2 ON T2.setCode = T1.code WHERE T2.translation = 'Hauptset Zehnte Edition',"['sets', 'set_translations']",[]
472,card_games,"among the sets in the block ""ice age"", how many of them have an italian translation?","sets in the block ""ice age"" refers to block = 'ice age'; italian translation refers to language = 'italian' and translation is not null",SELECT COUNT(DISTINCT T1.id) FROM sets AS T1 INNER JOIN set_translations AS T2 ON T2.setCode = T1.code WHERE T1.block = 'Ice Age' AND T2.language = 'Italian' AND T2.translation IS NOT NULL,"['sets', 'set_translations']",[]
473,card_games,is the set of cards with adarkar valkyrie only available outside the united states?,card set adarkar valkyrie refers to name = 'adarkar valkyrie'; isforeignonly = 1 means only available outside the united states;,"SELECT IIF(isForeignOnly = 1, 'YES', 'NO') FROM cards AS T1 INNER JOIN sets AS T2 ON T2.code = T1.setCode WHERE T1.name = 'Adarkar Valkyrie'","['cards', 'sets']",[]
474,card_games,"among the sets of cards that have an italian translation, how many of them have a base set number of under 100?",italian translation refers to language = 'italian'; have a translation means translation is not null; base set number of under 100 refers to basesetsize < 10,SELECT COUNT(T1.id) FROM sets AS T1 INNER JOIN set_translations AS T2 ON T2.setCode = T1.code WHERE T2.translation IS NOT NULL AND T1.baseSetSize < 100 AND T2.language = 'Italian',"['sets', 'set_translations']",[]
475,card_games,how many cards in the set coldsnap have a black border color?,card set coldsnap refers to name = 'coldsnap'; black border color refers to bordercolor = 'black',SELECT SUM(CASE WHEN T1.borderColor = 'black' THEN 1 ELSE 0 END) FROM cards AS T1 INNER JOIN sets AS T2 ON T2.code = T1.setCode WHERE T2.name = 'Coldsnap',"['cards', 'sets']",[]
476,card_games,please list the name of the cards in the set coldsnap with the highest converted mana cost.,card set coldsnap refers to name = 'coldsnap',SELECT T1.name FROM cards AS T1 INNER JOIN sets AS T2 ON T2.code = T1.setCode WHERE T2.name = 'Coldsnap' ORDER BY T1.convertedManaCost DESC LIMIT 1,"['cards', 'sets']",[]
477,card_games,"which of these artists have designed a card in the set coldsnap, jeremy jarvis, aaron miller or chippy?","card set coldsnap refers to name = 'coldsnap'; jeremy jarvis, aaron miller or chippy are the name of artists which refers to artist in ('jeremy jarvis', 'aaron miller','chippy');",SELECT T1.artist FROM cards AS T1 INNER JOIN sets AS T2 ON T2.code = T1.setCode WHERE (T2.name = 'Coldsnap' AND T1.artist = 'Chippy') OR (T2.name = 'Coldsnap' AND T1.artist = 'Aaron Miller') OR (T2.name = 'Coldsnap' AND T1.artist = 'Jeremy Jarvis') GROUP BY T1.artist,"['cards', 'sets']",[]
478,card_games,what is card number 4 in the set coldsnap?,card set coldsnap refers to name = 'coldsnap'; card number 4 refers to number = 4,SELECT T1.name FROM cards AS T1 INNER JOIN sets AS T2 ON T2.code = T1.setCode WHERE T2.name = 'Coldsnap' AND T1.number = 4,"['cards', 'sets']",[]
479,card_games,"among the cards with converted mana cost higher than 5 in the set coldsnap, how many of them have unknown power?",card set coldsnap refers to name = 'coldsnap'; converted mana cost higher than 5 refers to convertedmanacost > 5; unknown power refers to power = '*' or t1.power is null,SELECT SUM(CASE WHEN T1.power LIKE '*' OR T1.power IS NULL THEN 1 ELSE 0 END) FROM cards AS T1 INNER JOIN sets AS T2 ON T2.code = T1.setCode WHERE T2.name = 'Coldsnap' AND T1.convertedManaCost > 5,"['cards', 'sets']",[]
480,card_games,"what is the italian flavor text of the card ""ancestor's chosen""?","italian refers to language = 'italian'; flavor text refers to flavortext; ""ancestor''s chosen"" refers to name = 'ancestor''s chosen'",SELECT T2.flavorText FROM cards AS T1 INNER JOIN foreign_data AS T2 ON T2.uuid = T1.uuid WHERE T1.name = 'Ancestor''s Chosen' AND T2.language = 'Italian',"['cards', 'foreign_data']",[]
481,card_games,"please list all the foreign languages in which the card ""ancestor's chosen"" has a flavor text.","""ancestor''s chosen"" refers to name = 'ancestor''s chosen'; has a flavor text refers to flavortext is not null",SELECT T2.language FROM cards AS T1 INNER JOIN foreign_data AS T2 ON T2.uuid = T1.uuid WHERE T1.name = 'Ancestor''s Chosen' AND T2.flavorText IS NOT NULL,"['cards', 'foreign_data']",[]
482,card_games,"what's the german type of the card ""ancestor's chosen""?","german refers to language = 'german'; ""ancestor's chosen"" refers to name = 'ancestor''s chosen'",SELECT DISTINCT T1.type FROM cards AS T1 INNER JOIN foreign_data AS T2 ON T2.uuid = T1.uuid WHERE T1.name = 'Ancestor''s Chosen' AND T2.language = 'German',"['cards', 'foreign_data']",[]
483,card_games,please list the italian text ruling of all the cards in the set coldsnap.,card set coldsnap refers to name = 'coldsnap'; italian refers to language = 'italian',SELECT DISTINCT T1.text FROM foreign_data AS T1 INNER JOIN cards AS T2 ON T2.uuid = T1.uuid INNER JOIN sets AS T3 ON T3.code = T2.setCode WHERE T3.name = 'Coldsnap' AND T1.language = 'Italian',"['cards', 'foreign_data', 'sets']",[]
