question_id,db_id,question,evidence,SQL,table_names,cte_aliases
846,formula_1,please list the reference names of the drivers who are eliminated in the first period in race number 20.,driver reference name refers to driverref; first qualifying period refers to q1; drivers who are eliminated in the first qualifying period refers to 5 drivers with max(q1); race number refers to raceid;,SELECT T2.driverRef FROM qualifying AS T1 INNER JOIN drivers AS T2 ON T2.driverId = T1.driverId WHERE T1.raceId = 20 ORDER BY T1.q1 DESC LIMIT 5,"['drivers', 'qualifying']",[]
847,formula_1,what is the surname of the driver with the best lap time in race number 19 in the second qualifying period?,race number refers to raceid; second qualifying period refers to q2; best lap time refers to min(q2);,SELECT T2.surname FROM qualifying AS T1 INNER JOIN drivers AS T2 ON T2.driverId = T1.driverId WHERE T1.raceId = 19 ORDER BY T1.q2 ASC LIMIT 1,"['drivers', 'qualifying']",[]
848,formula_1,please list the year during which the race is held on circuits in shanghai.,shanghai is a name of location;,SELECT T2.year FROM circuits AS T1 INNER JOIN races AS T2 ON T2.circuitID = T1.circuitId WHERE T1.location = 'Shanghai',"['races', 'circuits']",[]
849,formula_1,where can the introduction of the races held on circuit de barcelona-catalunya be found?,introduction of races refers to url; circuit de barcelona-catalunya is a name of circuit;,SELECT DISTINCT T1.url FROM circuits AS T1 INNER JOIN races AS T2 ON T2.circuitID = T1.circuitId WHERE T1.name = 'Circuit de Barcelona-Catalunya',"['races', 'circuits']",[]
850,formula_1,please give the name of the race held on the circuits in germany.,germany is a name of country;,SELECT DISTINCT T2.name FROM circuits AS T1 INNER JOIN races AS T2 ON T2.circuitID = T1.circuitId WHERE T1.country = 'Germany',"['races', 'circuits']",[]
851,formula_1,please list the positions of the circuits built by the constructor renault.,renault is a name of constructor;,SELECT DISTINCT T1.position FROM constructorStandings AS T1 INNER JOIN constructors AS T2 ON T2.constructorId = T1.constructorId WHERE T2.name = 'Renault',"['constructors', 'constructorstandings']",[]
852,formula_1,how many races in the year 2010 are held on grand prixs outside asia and europe?,,"SELECT COUNT(T3.raceId) FROM circuits AS T1 INNER JOIN races AS T3 ON T3.circuitID = T1.circuitId WHERE T1.country NOT IN ( 'Bahrain', 'China', 'Singapore', 'Japan', 'Korea', 'Turkey', 'UAE', 'Malaysia', 'Spain', 'Monaco', 'Azerbaijan', 'Austria', 'Belgium', 'France', 'Germany', 'Hungary', 'Italy', 'UK' ) AND T3.year = 2010","['races', 'circuits']",[]
853,formula_1,please give the names of the races held on the circuits in spain.,spain is a name of country;,SELECT DISTINCT T2.name FROM circuits AS T1 INNER JOIN races AS T2 ON T2.circuitID = T1.circuitId WHERE T1.country = 'Spain',"['races', 'circuits']",[]
854,formula_1,what is the coordinates location of the circuits for australian grand prix?,"coordinate position/location refers to lat, lng; circuits for australian grand prix refers to races.name = 'australian grand prix'","SELECT DISTINCT T1.lat, T1.lng FROM circuits AS T1 INNER JOIN races AS T2 ON T2.circuitID = T1.circuitId WHERE T2.name = 'Australian Grand Prix'","['races', 'circuits']",[]
855,formula_1,where can i find the information about the races held on sepang international circuit?,information about races refers to url;,SELECT DISTINCT T1.url FROM circuits AS T1 INNER JOIN races AS T2 ON T2.circuitID = T1.circuitId WHERE T1.name = 'Sepang International Circuit',"['races', 'circuits']",[]
856,formula_1,please list the time of the races held on sepang international circuit.,,SELECT DISTINCT T2.time FROM circuits AS T1 INNER JOIN races AS T2 ON T2.circuitID = T1.circuitId WHERE T1.name = 'Sepang International Circuit',"['races', 'circuits']",[]
857,formula_1,give the coordinate position for abu dhabi grand prix.,"coordinate position/location refers to lat, lng; abu dhabi grand prix refers to races.name = 'abu dhabi grand prix'","SELECT DISTINCT T1.lat, T1.lng FROM circuits AS T1 INNER JOIN races AS T2 ON T2.circuitID = T1.circuitId WHERE T2.name = 'Abu Dhabi Grand Prix'","['races', 'circuits']",[]
858,formula_1,which country is the constructor which got 1 point in the race no. 24 from?,race number refers to raceid;,SELECT T2.nationality FROM constructorResults AS T1 INNER JOIN constructors AS T2 ON T2.constructorId = T1.constructorId WHERE T1.raceId = 24 AND T1.points = 1,"['constructors', 'constructorresults']",[]
859,formula_1,what's bruno senna's q1 result in the qualifying race no. 354?,race number refers to raceid; bruno senna refers to the full name of the driver; full name of the driver refers to drivers.forename and drivers.surname;,SELECT T1.q1 FROM qualifying AS T1 INNER JOIN drivers AS T2 ON T2.driverId = T1.driverId WHERE T1.raceId = 354 AND T2.forename = 'Bruno' AND T2.surname = 'Senna',"['drivers', 'qualifying']",[]
860,formula_1,"for the driver who had the q2 time as 0:01:40 in the qualifying race no. 355, what is his nationality?",race number refers to raceid;,SELECT DISTINCT T2.nationality FROM qualifying AS T1 INNER JOIN drivers AS T2 ON T2.driverId = T1.driverId WHERE T1.raceId = 355 AND T1.q2 LIKE '1:40%',"['drivers', 'qualifying']",[]
861,formula_1,what is his number of the driver who finished 0:01:54 in the q3 of qualifying race no.903?,race number refers to raceid; finished 0:0m:ss in the q3 refers to q3 like 'm:ss%',SELECT T2.number FROM qualifying AS T1 INNER JOIN drivers AS T2 ON T2.driverId = T1.driverId WHERE T1.raceId = 903 AND T1.q3 LIKE '1:54%',"['drivers', 'qualifying']",[]
862,formula_1,"for the bahrain grand prix in 2007, how many drivers not finished the game?",bahrain grand prix refers to races.name = 'bahrain grand prix'; drivers who finished the race refers to time is not empty (i.e. time is not null);,SELECT COUNT(T3.driverId) FROM races AS T1 INNER JOIN results AS T2 ON T2.raceId = T1.raceId INNER JOIN drivers AS T3 ON T3.driverId = T2.driverId WHERE T1.year = 2007 AND T1.name = 'Bahrain Grand Prix' AND T2.time IS NULL,"['races', 'drivers', 'results']",[]
863,formula_1,show me the season page of year when the race no. 901 took place.,race number refers to raceid;,SELECT T2.url FROM races AS T1 INNER JOIN seasons AS T2 ON T2.year = T1.year WHERE T1.raceId = 901,"['races', 'seasons']",[]
864,formula_1,"for the race happened on 2015/11/29, how many drivers finished the game?",game and race are synonyms; drivers who finished the race should have record in time;,SELECT COUNT(T2.driverId) FROM races AS T1 INNER JOIN results AS T2 ON T2.raceId = T1.raceId WHERE T1.date = '2015-11-29' AND T2.time IS NOT NULL,"['races', 'results']",[]
865,formula_1,"for all the drivers who finished the game in race no. 592, who is the oldest?","drivers who finished the race refers to time is not empty (i.e. time is not null); race number refers to raceid; date of birth refers to drivers.dob; the larger the birthday value, the younger the person is, and vice versa;","SELECT T1.forename, T1.surname FROM drivers AS T1 INNER JOIN results AS T2 ON T2.driverId = T1.driverId WHERE T2.raceId = 592 AND T2.time IS NOT NULL AND T1.dob IS NOT NULL ORDER BY T1.dob ASC LIMIT 1","['drivers', 'results']",[]
866,formula_1,who was the player that got the lap time of 0:01:27 in the race no. 161? show his introduction website.,player and driver are synonyms; the lap time of 0:0m:ss refers to laptime.time like 'm:ss%';race number refers to raceid; introduction website of the drivers refers to url;,"SELECT DISTINCT T2.forename, T2.surname, T2.url FROM lapTimes AS T1 INNER JOIN drivers AS T2 ON T2.driverId = T1.driverId WHERE T1.raceId = 161 AND T1.time LIKE '1:27%'","['drivers', 'laptimes']",[]
867,formula_1,"for the driver who set the fastest lap speed in race no.933, where does he come from?",fastest lap speed refers to max(fastestlapspeed);,SELECT T1.nationality FROM drivers AS T1 INNER JOIN results AS T2 ON T2.driverId = T1.driverId WHERE T2.raceId = 933 AND T2.fastestLapTime IS NOT NULL ORDER BY T2.fastestLapSpeed DESC LIMIT 1,"['drivers', 'results']",[]
868,formula_1,where is malaysian grand prix held? give the location coordinates.,"location coordinates refers to (lat, lng); malaysian grand prix refers to races.name = 'malaysian grand prix'","SELECT DISTINCT T1.lat, T1.lng FROM circuits AS T1 INNER JOIN races AS T2 ON T2.circuitID = T1.circuitId WHERE T2.name = 'Malaysian Grand Prix'","['races', 'circuits']",[]
869,formula_1,"for the constructor which got the highest point in the race no. 9 , what is its introduction website?",race number refers to raceid; constructor which got the highest point refers to max(constructorresults.points); introduction website of the constructor refers to url;,SELECT T2.url FROM constructorResults AS T1 INNER JOIN constructors AS T2 ON T2.constructorId = T1.constructorId WHERE T1.raceId = 9 ORDER BY T1.points DESC LIMIT 1,"['constructors', 'constructorresults']",[]
870,formula_1,what's lucas di grassi's q1 result in the race no. 345?,race number refers to raceid;,SELECT T1.q1 FROM qualifying AS T1 INNER JOIN drivers AS T2 ON T2.driverId = T1.driverId WHERE T1.raceId = 345 AND T2.forename = 'Lucas' AND T2.surname = 'di Grassi',"['drivers', 'qualifying']",[]
871,formula_1,"for the driver who had the q2 time as 0:01:15 in race no. 347, where is he from?",race number refers to raceid;,SELECT DISTINCT T2.nationality FROM qualifying AS T1 INNER JOIN drivers AS T2 ON T2.driverId = T1.driverId WHERE T1.raceId = 347 AND T1.q2 LIKE '1:15%',"['drivers', 'qualifying']",[]
872,formula_1,"in the race no. 45, for the driver who had the q3 time as 0:01:33, what is his abbreviated code?",race number refers to raceid; had the q3 time as 0:0m:ss refers to q3 like 'm:ss%',SELECT T2.code FROM qualifying AS T1 INNER JOIN drivers AS T2 ON T2.driverId = T1.driverId WHERE T1.raceId = 45 AND T1.q3 LIKE '1:33%',"['drivers', 'qualifying']",[]
873,formula_1,what is the actual finish time for bruce mclaren in the race no.743?,race number refers to raceid;,SELECT T2.time FROM drivers AS T1 INNER JOIN results AS T2 ON T2.driverId = T1.driverId WHERE T2.raceId = 743 AND T1.forename = 'Bruce' AND T1.surname = 'McLaren',"['drivers', 'results']",[]
874,formula_1,who finished second in the san marino grand prix in 2006?,finished second refers to position = 2;,"SELECT T3.forename, T3.surname FROM races AS T1 INNER JOIN results AS T2 ON T2.raceId = T1.raceId INNER JOIN drivers AS T3 ON T3.driverId = T2.driverId WHERE T1.year = 2006 AND T1.name = 'San Marino Grand Prix' AND T2.position = 2","['races', 'drivers', 'results']",[]
876,formula_1,"for the race happened in 2015/11/29, how many drivers did not finish the game?",game and race are synonyms; drivers who didn't finish the race should have record in time;,SELECT COUNT(T2.driverId) FROM races AS T1 INNER JOIN results AS T2 ON T2.raceId = T1.raceId WHERE T1.date = '2015-11-29' AND T2.time IS NULL,"['races', 'results']",[]
877,formula_1,"for all the drivers who finished the game in race no. 872, who is the youngest?",race number refers to raceid; drivers who finished the race refers to time has value; the youngest is a driver where max(dob);,"SELECT T1.forename, T1.surname FROM drivers AS T1 INNER JOIN results AS T2 ON T2.driverId = T1.driverId WHERE T2.raceId = 872 AND T2.time IS NOT NULL ORDER BY T1.dob DESC LIMIT 1","['drivers', 'results']",[]
878,formula_1,who was the driver that got the best lap time in the race no. 348? give his full name.,race number refers to raceid; the best lap time refers to min(time),"SELECT T2.forename, T2.surname FROM lapTimes AS T1 INNER JOIN drivers AS T2 ON T2.driverId = T1.driverId WHERE T1.raceId = 348 ORDER BY T1.time ASC LIMIT 1","['drivers', 'laptimes']",[]
879,formula_1,"for the driver who set the fastest lap speed, what is his nationality?",the fastest lap speed refers to (max) fastestlapspeed;,SELECT T1.nationality FROM drivers AS T1 INNER JOIN results AS T2 ON T2.driverId = T1.driverId ORDER BY T2.fastestLapSpeed DESC LIMIT 1,"['drivers', 'results']",[]
880,formula_1,"paul di resta was in the no. 853 race, what percent faster did he finish in the 853rd race than the next race for the fastest lap speed?","paul di resta refers to the full name of the driver; full name of the driver refers to drivers.forename ='paul' and drivers.surname = 'di resta'; race number refers to raceid; percentage = divide(subtract(fastestlapspeed(raceid = 853), (fastestlapspeed (raceid = 854)) * 100 , (fastestlapspeed(raceid = 853))","SELECT (SUM(IIF(T2.raceId = 853, T2.fastestLapSpeed, 0)) - SUM(IIF(T2.raceId = 854, T2.fastestLapSpeed, 0))) * 100 / SUM(IIF(T2.raceId = 853, T2.fastestLapSpeed, 0)) FROM drivers AS T1 INNER JOIN results AS T2 ON T2.driverId = T1.driverId WHERE T1.forename = 'Paul' AND T1.surname = 'di Resta'","['drivers', 'results']",[]
881,formula_1,"for the drivers who took part in the race in 1983/7/16, what's their race completion rate?","divide(count(driverid when time has value ), (count(driverid )) as percentage; in 1983/7/16 refers to when date = '1983-07-16'",SELECT CAST(COUNT(CASE WHEN T2.time IS NOT NULL THEN T2.driverId END) AS REAL) * 100 / COUNT(T2.driverId) FROM races AS T1 INNER JOIN results AS T2 ON T2.raceId = T1.raceId WHERE T1.date = '1983-07-16',"['races', 'results']",[]
882,formula_1,which year was the first singapore grand prix?,the first race refers to race happened in min(year);,SELECT year FROM races WHERE name = 'Singapore Grand Prix' ORDER BY year ASC LIMIT 1,['races'],[]
883,formula_1,how many races were there in 2005? name all the races in descending order.,,SELECT name FROM races WHERE year = 2005 ORDER BY name DESC,['races'],[]
884,formula_1,list the names of all races that occurred in the earliest recorded year and month.,earliest recorded year and month refers to year = year(min(date)) and month = month(min(date));,"SELECT name FROM races WHERE STRFTIME('%Y', date) = ( SELECT STRFTIME('%Y', date) FROM races ORDER BY date ASC LIMIT 1 ) AND STRFTIME('%m', date) = ( SELECT STRFTIME('%m', date) FROM races ORDER BY date ASC LIMIT 1 )",['races'],[]
885,formula_1,state the name and date of the last round of race in year 1999.,the last round refers to max(round);,"SELECT name, date FROM races WHERE year = 1999 ORDER BY round DESC LIMIT 1",['races'],[]
886,formula_1,which year has the most number of races?,the most number of races refers to max(round);,SELECT year FROM races GROUP BY year ORDER BY COUNT(round) DESC LIMIT 1,['races'],[]
887,formula_1,name the races in year 2017 that are not hosted in year 2000.,not hosted means not in;,SELECT name FROM races WHERE year = 2017 AND name NOT IN ( SELECT name FROM races WHERE year = 2000 ),['races'],[]
888,formula_1,in which country was the first european grand prix hosted? name the circuit and location.,the first refers to min(year);,"SELECT T1.country, T1.location FROM circuits AS T1 INNER JOIN races AS T2 ON T2.circuitID = T1.circuitId WHERE T2.name = 'European Grand Prix' ORDER BY T2.year ASC LIMIT 1","['races', 'circuits']",[]
889,formula_1,when was the last f1 season whereby brands hatch hosted the british grand prix?,the last refers to max(year);,SELECT T2.date FROM circuits AS T1 INNER JOIN races AS T2 ON T2.circuitID = T1.circuitId WHERE T1.name = 'Brands Hatch' AND T2.name = 'British Grand Prix' ORDER BY T2.year DESC LIMIT 1,"['races', 'circuits']",[]
890,formula_1,how many seasons has silverstone circuit hosted the united kindom grand prix?,british grand prix is the name of race; british refers to the united kindom,SELECT COUNT(T2.circuitid) FROM circuits AS T1 INNER JOIN races AS T2 ON T2.circuitID = T1.circuitId WHERE T1.name = 'Silverstone Circuit' AND T2.name = 'British Grand Prix',"['races', 'circuits']",[]
891,formula_1,name all drivers in the 2010 singapore grand prix order by their position stands.,,"SELECT T3.forename, T3.surname FROM races AS T1 INNER JOIN driverStandings AS T2 ON T2.raceId = T1.raceId INNER JOIN drivers AS T3 ON T3.driverId = T2.driverId WHERE T1.name = 'Singapore Grand Prix' AND T1.year = 2010 ORDER BY T2.position ASC","['races', 'driverstandings', 'drivers']",[]
892,formula_1,state the driver with the most points scored. find his full name with that points.,the most points scored refers to max(points); full name of the driver refers to drivers.forename and drivers.surname;,"SELECT T3.forename, T3.surname, T2.points FROM races AS T1 INNER JOIN driverStandings AS T2 ON T2.raceId = T1.raceId INNER JOIN drivers AS T3 ON T3.driverId = T2.driverId ORDER BY T2.points DESC LIMIT 1","['races', 'driverstandings', 'drivers']",[]
893,formula_1,name the top 3 drivers and the points they scored in the 2017 chinese grand prix.,,"SELECT T3.forename, T3.surname, T2.points FROM races AS T1 INNER JOIN driverStandings AS T2 ON T2.raceId = T1.raceId INNER JOIN drivers AS T3 ON T3.driverId = T2.driverId WHERE T1.name = 'Chinese Grand Prix' AND T1.year = 2017 ORDER BY T2.points DESC LIMIT 3","['races', 'driverstandings', 'drivers']",[]
894,formula_1,what is the best lap time recorded? list the driver and race with such recorded lap time.,the best lap time refers to min(milliseconds); list the driver refers to drivers.forename and drivers.surname; list the race refers to races.name,"SELECT T2.milliseconds, T1.forename, T1.surname, T3.name FROM drivers AS T1 INNER JOIN lapTimes AS T2 ON T1.driverId = T2.driverId INNER JOIN races AS T3 ON T2.raceId = T3.raceId ORDER BY T2.milliseconds ASC LIMIT 1","['drivers', 'laptimes', 'races']",[]
895,formula_1,what is the average lap time for lewis hamilton in the 2009 malaysian grand prix?,average lap time = avg(milliseconds); 'lewis hamilton' refers to the full name of the driver; full name of the driver refers to drivers.forename and drivers.surname; 'malaysian grand prix' refers to races.name = 'malaysian grand prix',SELECT AVG(T2.milliseconds) FROM races AS T1 INNER JOIN lapTimes AS T2 ON T2.raceId = T1.raceId INNER JOIN drivers AS T3 ON T3.driverId = T2.driverId WHERE T3.forename = 'Lewis' AND T3.surname = 'Hamilton' AND T1.year = 2009 AND T1.name = 'Malaysian Grand Prix',"['races', 'laptimes', 'drivers']",[]
896,formula_1,calculate the percentage whereby hamilton was not at the 1st track of the the f1 circuit since 2010.,"percentage = divide(count(raceid) where surname = 'hamilton' and position>1), (count(raceid) where surname = 'hamilton'); since 2010 refers to year >= 2010",SELECT CAST(COUNT(CASE WHEN T2.position <> 1 THEN T2.position END) AS REAL) * 100 / COUNT(T2.driverStandingsId) FROM races AS T1 INNER JOIN driverStandings AS T2 ON T2.raceId = T1.raceId INNER JOIN drivers AS T3 ON T3.driverId = T2.driverId WHERE T3.surname = 'Hamilton' AND T1.year >= 2010,"['races', 'driverstandings', 'drivers']",[]
897,formula_1,name the driver with the most winning. mention his nationality and what is his maximum point scores.,full name of the driver refers to drivers.forename and drivers.surname; the most winning refers to max(count(wins)); average point scores refers to max(points);,"SELECT T1.forename, T1.surname, T1.nationality, MAX(T2.points) FROM drivers AS T1 INNER JOIN driverStandings AS T2 ON T2.driverId = T1.driverId WHERE T2.wins >= 1 GROUP BY T1.forename, T1.surname, T1.nationality ORDER BY COUNT(T2.wins) DESC LIMIT 1","['drivers', 'driverstandings']",[]
898,formula_1,how old is the youngest japanese driver? what is his name?,"date of birth refers to drivers.dob; the larger the birthday value, the younger the person is, and vice versa; japanese refers to nationality = 'japanese'; age = year(current_timestamp) - year(dob);","SELECT STRFTIME('%Y', CURRENT_TIMESTAMP) - STRFTIME('%Y', dob), forename , surname FROM drivers WHERE nationality = 'Japanese' ORDER BY dob DESC LIMIT 1",['drivers'],[]
899,formula_1,list circuits which host 4 f1 races from year 1990 to 2000.,from year 1990 to 2000 refers to year(date) between 1990 and 2000;,"SELECT DISTINCT T1.name FROM circuits AS T1 INNER JOIN races AS T2 ON T2.circuitID = T1.circuitId WHERE STRFTIME('%Y', T2.date) BETWEEN '1990' AND '2000' GROUP BY T1.name HAVING COUNT(T2.raceId) = 4","['races', 'circuits']",[]
900,formula_1,list circuits in usa which hosted f1 races in 2006. state the name and location of circuit and the name of the race it hosted.,,"SELECT T1.name, T1.location, T2.name FROM circuits AS T1 INNER JOIN races AS T2 ON T2.circuitID = T1.circuitId WHERE T1.country = 'USA' AND T2.year = 2006","['races', 'circuits']",[]
901,formula_1,name the races along with its circuit name and location for f1 races hosted in september 2005.,in september 2005 refers to month(date) = 9 and year(date) = 2005,"SELECT DISTINCT T2.name, T1.name, T1.location FROM circuits AS T1 INNER JOIN races AS T2 ON T2.circuitID = T1.circuitId WHERE T2.year = 2005 AND STRFTIME('%m', T2.date) = '09'","['races', 'circuits']",[]
902,formula_1,which race was alex yoong in when he was in track number less than 20?,alex yoong refers to the full name of the driver; full name of the driver refers to drivers.forename and drivers.surname;track number less than 10 refers to position < 20,SELECT T1.name FROM races AS T1 INNER JOIN driverStandings AS T2 ON T2.raceId = T1.raceId INNER JOIN drivers AS T3 ON T3.driverId = T2.driverId WHERE T3.forename = 'Alex' AND T3.surname = 'Yoong' AND T2.position < 20,"['races', 'driverstandings', 'drivers']",[]
903,formula_1,how many times did michael schumacher won from races hosted in sepang international circuit?,win from races refers to max(points),SELECT SUM(T2.wins) FROM drivers AS T1 INNER JOIN driverStandings AS T2 ON T2.driverId = T1.driverId INNER JOIN races AS T3 ON T3.raceId = T2.raceId INNER JOIN circuits AS T4 ON T4.circuitId = T3.circuitId WHERE T1.forename = 'Michael' AND T1.surname = 'Schumacher' AND T4.name = 'Sepang International Circuit',"['drivers', 'circuits', 'driverstandings', 'races']",[]
904,formula_1,state the race and year of race in which michael schumacher had his fastest lap.,fastest lap refers to min(milliseconds); alex yoong refers to the full name of the driver; full name of the driver refers to drivers.forename and drivers.surname;,"SELECT T1.name, T1.year FROM races AS T1 INNER JOIN lapTimes AS T2 ON T2.raceId = T1.raceId INNER JOIN drivers AS T3 ON T3.driverId = T2.driverId WHERE T3.forename = 'Michael' AND T3.surname = 'Schumacher' ORDER BY T2.milliseconds ASC LIMIT 1","['races', 'laptimes', 'drivers']",[]
905,formula_1,what is eddie irvine's average points scored in year 2000?,average points = avg(points where year = 2000),SELECT AVG(T2.points) FROM drivers AS T1 INNER JOIN driverStandings AS T2 ON T2.driverId = T1.driverId INNER JOIN races AS T3 ON T3.raceId = T2.raceId WHERE T1.forename = 'Eddie' AND T1.surname = 'Irvine' AND T3.year = 2000,"['drivers', 'driverstandings', 'races']",[]
906,formula_1,which was lewis hamilton first race? what was his points recorded for his first race event?,first race refers to min(year); lewis hamiltonrefers to the full name of the driver; full name of the driver refers to drivers.forename and drivers.surname;,"SELECT T1.name, T2.points FROM races AS T1 INNER JOIN driverStandings AS T2 ON T2.raceId = T1.raceId INNER JOIN drivers AS T3 ON T3.driverId = T2.driverId WHERE T3.forename = 'Lewis' AND T3.surname = 'Hamilton' ORDER BY T1.year ASC LIMIT 1","['races', 'driverstandings', 'drivers']",[]
907,formula_1,list all races in 2017 and the hosting country order by date of the event.,,"SELECT DISTINCT T2.name, T1.country FROM circuits AS T1 INNER JOIN races AS T2 ON T2.circuitID = T1.circuitId WHERE T2.year = 2017 ORDER BY T2.date ASC","['races', 'circuits']",[]
908,formula_1,"what is the most laps f1 races had? name the race, year and circuit location where the races with most laps was hosted.",,"SELECT T3.lap, T2.name, T2.year, T1.location FROM circuits AS T1 INNER JOIN races AS T2 ON T1.circuitId = T2.circuitId INNER JOIN lapTimes AS T3 ON T3.raceId = T2.raceId ORDER BY T3.lap DESC LIMIT 1","['races', 'circuits', 'laptimes']",[]
909,formula_1,"among all european grand prix races, what is the percentage of the races were hosted in germany?","european grand prix races refers to races.name = 'european grand prix';percentage = divide(count(races where country = germany and name = 'europearn grand prix'),count(races where name = 'europearn grand prix'))*100",SELECT CAST(COUNT(CASE WHEN T1.country = 'Germany' THEN T2.circuitID END) AS REAL) * 100 / COUNT(T2.circuitId) FROM circuits AS T1 INNER JOIN races AS T2 ON T2.circuitID = T1.circuitId WHERE T2.name = 'European Grand Prix',"['races', 'circuits']",[]
910,formula_1,what's the location coordinates of silverstone circuit?,"location coordinates refers to (lat, lng); silverstone circuit refers to circuits.name = 'silverstone circuit'","SELECT lat, lng FROM circuits WHERE name = 'Silverstone Circuit'",['circuits'],[]
911,formula_1,"which of these circuits is located at a higher latitude, silverstone circuit, hockenheimring or hungaroring?",higher latitude refers to max(lat),"SELECT name FROM circuits WHERE name IN ('Silverstone Circuit', 'Hockenheimring', 'Hungaroring') ORDER BY lat DESC LIMIT 1",['circuits'],[]
912,formula_1,what's the reference name of marina bay street circuit?,reference name refers to circuitref; marina bay street circuit refers to circuits.name = 'marina bay street circuit',SELECT circuitRef FROM circuits WHERE name = 'Marina Bay Street Circuit',['circuits'],[]
913,formula_1,in which country can i find the circuit with the highest altitude?,highest altitude refers to max(alt),SELECT country FROM circuits ORDER BY alt DESC LIMIT 1,['circuits'],[]
914,formula_1,how many drivers don't have a code?,don't have a code refers to code is null,SELECT COUNT(driverId) - COUNT(CASE WHEN code IS NOT NULL THEN code END) FROM drivers,['drivers'],[]
